{
  "spec": "alms.dev/protocol-neutrality-matrix/v0",
  "generated_offline": true,
  "disclaimer": "P0.6C cross-lane protocol-neutrality matrix. Derived from offline-mock evidence and code review against installed SDK/framework shapes and current schema behavior. It is implementation-shape evidence only, NOT live provider semantic evidence, and NOT the ALMS runtime contract. No live provider request was made during P0.6C.",
  "provenance_vocabulary": [
    "provider_native",
    "framework_native",
    "sdk_convenience",
    "probe_derived",
    "normalizer_derived",
    "local_estimate",
    "fixture_expected",
    "unavailable",
    "unverified_until_live"
  ],
  "lanes": ["openai-native", "langchain", "anthropic-native", "gemini-native"],
  "fixture_coverage": {
    "openai-native": {
      "fixtures": ["GEN-001", "ROLE-001", "STR-001", "TOOL-001", "STREAM-001", "USAGE-001"],
      "execution": "offline_mock via real openai-native probe subprocess (CLI -> planner -> runner -> probe subprocess -> raw -> OpenAI normalizer -> results -> summary); zero provider calls / network / credential.",
      "evidence": "harness/tests/test_lane_dispatch.py::test_full_offline_openai_simulation_all_six; also test_compare.py::test_four_lane_diversity_comparison"
    },
    "langchain": {
      "fixtures": ["GEN-001", "ROLE-001", "STR-001", "TOOL-001", "STREAM-001", "USAGE-001"],
      "execution": "offline_mock via real langchain probe subprocess; zero provider calls / network / credential.",
      "evidence": "harness/tests/test_lane_dispatch.py::test_full_offline_langchain_simulation_all_six; also test_compare.py::test_four_lane_diversity_comparison"
    },
    "anthropic-native": {
      "fixtures": ["GEN-001", "ROLE-001", "STR-001", "TOOL-001", "STREAM-001", "USAGE-001"],
      "execution": "offline_mock via real anthropic-native probe subprocess; zero provider calls / network / credential.",
      "evidence": "harness/tests/test_lane_dispatch.py::test_full_offline_anthropic_simulation_all_six; also test_compare.py::test_four_lane_diversity_comparison"
    },
    "gemini-native": {
      "fixtures": ["GEN-001", "ROLE-001", "STR-001", "TOOL-001", "STREAM-001", "USAGE-001"],
      "execution": "offline_mock via real gemini-native probe subprocess; store=false on every request; zero provider calls / network / credential.",
      "evidence": "harness/tests/test_lane_dispatch.py::test_full_offline_gemini_simulation_all_six; also test_compare.py::test_four_lane_diversity_comparison"
    }
  },
  "findings": [
    {
      "id": "N-01",
      "severity": "F1",
      "dimension": "usage",
      "summary": "results._usage_block hardcoded provenance=reported for all present usage, so LangChain framework-normalized usage_metadata was indistinguishable from provider-reported usage.",
      "status": "resolved_offline"
    },
    {
      "id": "N-02",
      "severity": "F1",
      "dimension": "usage",
      "summary": "results._usage_block read only OpenAI-nested cache/reasoning paths, so Anthropic cache_creation/cache_read and LangChain input_token_details tokens were dropped to null in the result summary; the result schema had no cache-creation/cache-read split.",
      "status": "resolved_offline"
    },
    {
      "id": "N-03",
      "severity": "F2",
      "dimension": "terminal_state",
      "summary": "Native provider/framework terminal states (requires_action, incomplete, budget_exceeded, refusal, stop_reason, finish_reason) were preserved only inside the transcript and collapsed to PASS/PASS_WITH_EXTENSION at the result level, with no queryable native-terminal field.",
      "status": "resolved_offline"
    },
    {
      "id": "N-04",
      "severity": "F2",
      "dimension": "provenance",
      "summary": "No centrally-owned provenance vocabulary existed; provider-vs-framework and reported-vs-estimated distinctions were expressed only by scattered signals.",
      "status": "resolved_offline"
    },
    {
      "id": "N-05",
      "severity": "F3",
      "dimension": "model_identity",
      "summary": "probe-response.model holds the requested/configured model id; the provider-returned served model was preserved only in the raw response artifact, with no first-class returned-model field. Closed offline in P0.6D: result.observed_model_identity now carries requested_model / observed_returned_model / observed_returned_model_source / observed_returned_model_raw_ref / execution_mode / model_identity_match, derived per-lane from raw evidence with no fabrication and no canonicalization. Real returned-vs-requested provider routing/alias/snapshot behavior stays unverified_until_live.",
      "status": "resolved_offline"
    }
  ],
  "dimensions": [
    {
      "dimension": "request_representation",
      "description": "System instruction placement, message/input/step shape, model identity, output-token limit, timeout/retry ownership. Requested model kept separate from observed returned (see the model_identity dimension for the P0.6D closure of N-05).",
      "by_lane": {
        "openai-native": { "representation": "Responses API input list + instructions; requested model on probe-response.model; served model on the raw response.", "provenance": "provider_native", "preserved": "preserved", "notes": "output-token limit + timeout/retry owned by probe controls (probe_derived)." },
        "langchain": { "representation": "framework message objects -> provider request; requested model recorded exactly, never defaulted.", "provenance": "framework_native", "preserved": "preserved", "notes": "framework mediates request shaping; retry ownership is framework-internal (retry_count_observed may be null)." },
        "anthropic-native": { "representation": "Messages API top-level system + messages; requested model on probe-response.model.", "provenance": "provider_native", "preserved": "preserved", "notes": "system is a separate top-level field, not a message role." },
        "gemini-native": { "representation": "Interactions API top-level system_instruction + user_input step; store=false always; no previous_interaction_id.", "provenance": "provider_native", "preserved": "preserved", "notes": "requested model on manifest; served model kept separately on the Interaction (see model_identity)." }
      }
    },
    {
      "dimension": "model_identity",
      "description": "Requested vs observed returned model, surfaced at the result level via observed_model_identity (P0.6D, N-05 resolved_offline). requested_model (request-side config) is never overwritten by, nor conflated with, observed_returned_model; a populated observed value carries an auditable raw_ref; source uses the central provenance vocabulary; exact strings are preserved (no canonicalization); a requested/observed mismatch is recorded, never auto-classified as an error. Offline observed values are fixture_expected; real returned-vs-requested routing/alias/snapshot behavior is unverified_until_live.",
      "by_lane": {
        "openai-native": { "representation": "served model read from the native Responses object (response.model / stream response.completed); requested model on the manifest.", "provenance": "provider_native", "preserved": "preserved", "notes": "offline source=fixture_expected; live source=provider_native (unverified_until_live). Alias/snapshot never resolved." },
        "langchain": { "representation": "model id exposed only through framework response_metadata (model_name); requested model on the manifest.", "provenance": "framework_native", "preserved": "preserved", "notes": "NEVER provider_native even when the string resembles an OpenAI id. Offline mock exposes model_name='offline-fake' != requested -> a recorded mismatch (model_identity_match=false), not an error." },
        "anthropic-native": { "representation": "served model read from the native Message resource (message.model / message_start); requested model on the manifest.", "provenance": "provider_native", "preserved": "preserved", "notes": "absent message model stays unavailable, never substituted from the requested model." },
        "gemini-native": { "representation": "served model read from the full Interaction resource (interaction.model), NOT the output_text convenience projection; requested model on the manifest.", "provenance": "provider_native", "preserved": "preserved", "notes": "convenience projection never used as model authority; offline source=fixture_expected." }
      }
    },
    {
      "dimension": "response_containers",
      "description": "Authoritative raw container vs SDK convenience projection. Normalizers read authoritative structures (items/content-blocks/steps/messages), never convenience accessors.",
      "by_lane": {
        "openai-native": { "representation": "response.output items (message/function_call); output_text is a convenience projection not relied upon.", "provenance": "provider_native", "preserved": "preserved", "notes": "output_text would be sdk_convenience; normalizer uses output items." },
        "langchain": { "representation": "AIMessage / AIMessageChunk; concrete framework types stay inside event data, never exposed as audit event types.", "provenance": "framework_native", "preserved": "preserved", "notes": "DevSpec Section 48 special rule honored." },
        "anthropic-native": { "representation": "Message content blocks (text/tool_use/unknown).", "provenance": "provider_native", "preserved": "preserved", "notes": "unknown block types preserved verbatim as provider_extension." },
        "gemini-native": { "representation": "Interaction resource + chronological steps; output_text convenience projection not relied upon.", "provenance": "provider_native", "preserved": "preserved", "notes": "step-based container, not item-based; retained not reshaped to items." }
      }
    },
    {
      "dimension": "structured_output",